title,authors,description,average_rating,published_date,categories
Maid,Stephanie Land,"Il est arrivé qu’un écrivain devienne femme de ménage. Pour vivre de l’intérieur une condition sociale qui n’était pas la sienne, et pouvoir témoigner, dénoncer les conditions de travail indignes, les horaires inhumains, mettre sa plume au service de celles que personne n’écoute. Ce fut le cas de Florence Aubenas, et de Barbara Ehrenreich qui signe la préface de ce livre. Mais il arrive – plus rarement - que ce soit l’inverse. Qu’une femme de ménage devienne écrivain. Au début de ce récit, Stephanie Land est la mère d’une petite fille de deux ans et, pour vivre, elle nettoie des maisons auxquelles elle s’amuse à donner des noms romanesques : la Maison du Clown, la Maison Porno, la Maison Triste, la Maison de la Femme qui entasse... À la fin, sa fille a sept ans et s’apprête à lui sauter au cou pour la féliciter : Stephanie va recevoir son diplôme de création littéraire de l’université de Missoula. Montana. Entre les deux, Stephanie a briqué, balayé, frotté, rangé, et vu l’envers du décor de l’Amérique triomphante. Elle a aspiré la poussière chez les autres, et aspiré à devenir quelqu’un d’autre. Elle raconte.",Note non disponible,2020-10-07,Biography & Autobiography
Dog Man: Grime and Punishment: A Graphic Novel (Dog Man #9): From the Creator of Captain Underpants,Dav Pilkey,"The mayor has had enough of Dog Man's shenanigans in the ninth book from worldwide bestselling author and artist Dav Pilkey. Dog Man's really done it this time! He hands over his badge and clears out his desk, but while he may be out of a job, he's not yet out of hope. With his friends at his side, can Dog Man dig himself out of this hole and paw his way back onto the force? Dav Pilkey's wildly popular Dog Man series appeals to readers of all ages and explores universally positive themes, including empathy, kindness, persistence, and the importance of doing good.",4.5,2020-09-01,Juvenile Fiction
Dog Man: Grime and Punishment: A Graphic Novel (Dog Man #9): From the Creator of Captain Underpants,Dav Pilkey,"The mayor has had enough of Dog Man's shenanigans in the ninth book from worldwide bestselling author and artist Dav Pilkey. Dog Man's really done it this time! He hands over his badge and clears out his desk, but while he may be out of a job, he's not yet out of hope. With his friends at his side, can Dog Man dig himself out of this hole and paw his way back onto the force? Dav Pilkey's wildly popular Dog Man series appeals to readers of all ages and explores universally positive themes, including empathy, kindness, persistence, and the importance of doing good.",4.5,2020-09-01,Juvenile Fiction
Dog Man 08: Fetch-22,Dav Pilkey,The 8th book in the bestselling DOG MAN series from Dav Pilkey!,Note non disponible,2020-11-05,Cats
All That Glitters,Danielle Steel,"#1 NEW YORK TIMES BESTSELLER • In Danielle Steel’s dazzling new novel, a young woman must overcome tremendous adversity in her quest to find herself and achieve real happiness. Nicole “Coco” Martin is destined to have it all. As the only child of doting and successful parents, she has been given every opportunity in life. Having inherited her mother’s stunning beauty and creativity, along with her father’s work ethic and diligence, she has the world at her feet. Her graduation from Columbia is fast approaching, and with it the summer job of her dreams working at a magazine. Between work, leisurely weekends at her family’s home in Southampton, and spending as much time as possible with her best friend, Sam, life couldn’t be better—until tragedy strikes. Coco’s beloved parents are killed in a terrorist attack while on vacation in France. Now devastated and alone, Coco must find a way to move forward and make her way in the world without the family she loved. Determined to forge her own path and make her parents proud, Coco pursues her dreams, dazzled by exciting opportunities that come her way. Her goals are to think outside the box—and always play by her own rules. As she finds herself drawn to charismatic, fascinating men, each relationship will teach Coco new lessons, some delightful, some painful. She will come to realize what matters, and how strong she truly is—and in the end, she will discover herself. Richly exploring one woman’s poignant journey through life, All That Glitters is a compelling tale of challenges, heartbreak, discovery, and triumph, a powerful reminder that all that glitters is not the essence of life. And what is truly worth having was right there in our hands all along.",Note non disponible,2020-11-17,Fiction
Tom Clancy Shadow of the Dragon,Marc Cameron,"A missing Chinese scientist, unexplained noises emanating from under the Arctic ice, and a possible mole in American intelligence are just some of the problems that plague President Jack Ryan in the latest entry in Tom Clancy's #1 New York Times bestselling series. Aboard an icebreaker in the Arctic Ocean a sonar operator hears an unusual noise coming from the ocean floor. She can't isolate it and chalks the event up to an anomaly in a newly installed system. Meanwhile, operatives with the Chinese Ministry of State Security are dealing with their own mystery--the disappearance of brilliant but eccentric scientist, Liu Wangshu. They're desperate to keep his crucial knowledge of aerospace and naval technology out of their rivals' hands. Finding Liu is too great an opportunity for any intelligence service to pass up, but there's one more problem. A high-level Chinese mole, codenamed Surveyor, has managed to infiltrate American Intelligence. President Jack Ryan has only one choice: send John Clark and his Campus team deep into China to find an old graduate student of the professor's who may hold the key to his whereabouts. It's a dangerous gamble, but with John Clark holding the cards, Jack Ryan is all in.",Note non disponible,2020-11-17,Fiction
The Law of Innocence,Michael Connelly,"THE TRIAL OF A LIFETIME. BUT WILL IT BE HIS LAST? 'Another masterpiece from one of the world's greatest crime writers' Express 'This is Connelly on top form ... A terrific thriller' Mail on Sunday 'Grabs you on the very first page and doesn't let go' The Times * * * * * Heading home after winning his latest case, defense attorney Mickey Haller - The Lincoln Lawyer - is pulled over by the police. They open the trunk of his car to find the body of a former client. Haller knows the law inside out. He will be charged with murder. He will have to build his case from behind bars. And the trial will be the trial of his life. Because Mickey Haller will defend himself in court. With watertight evidence stacked against him, Haller will need every trick in the book to prove he was framed. But a not-guilty verdict isn't enough. In order to truly walk free, Haller knows he must find the real killer - that is the law of innocence... * * * * * 'Pick up this gripping book at your peril, especially if you have other things to do like working or sleeping.' Express 'The so-called Lincoln Lawyer ... turns in another dazzling courtroom performance' New York Times Book Review * * * * * ""The law of innocence is unwritten. It will not be found in a leather-bound code book. It will never be argued in a courtroom. In nature, for every action there is an equal and opposite reaction. In the law of innocence, for every man not guilty of a crime there is a man out there who is. And to prove true innocence the guilty man must be found and exposed to the world."" * * * * * CRIME DOESN'T COME BETTER THAN CONNELLY. 'One of the very best writers working today' Sunday Telegraph 'The pre-eminent detective novelist of his generation' Ian Rankin 'A superb natural storyteller' Lee Child 'A master' Stephen King 'Crime thriller writing of the highest order' Guardian 'America's greatest living crime writer' Daily Express 'A crime writing genius' Independent on Sunday",Note non disponible,2020-11-10,Fiction
The Silent Wife,Karin Slaughter,"WATCH WILL TRENT ON ABC! “If you’re into mystery thrillers, then you’re into Karin Slaughter.” —THESKIMM He watches. He waits. He takes. Who will be next . . . THE SILENT WIFE Investigating the killing of a prisoner during a riot inside a state penitentiary, GBI investigator Will Trent is confronted with disturbing information. One of the inmates claims that he is innocent of a brutal attack for which he has always been the prime suspect. The man insists that he was framed by a corrupt law enforcement team led by Jeffrey Tolliver and that the real culprit is still out there—a serial killer who has systematically been preying on women across the state for years. If Will reopens the investigation and implicates the dead police officer with a hero’s reputation of wrongdoing, the opportunistic convict is willing to provide the information GBI needs about the riot murder. Only days ago, another young woman was viciously murdered in a state park in northern Georgia. Is it a fluke, or could there be a serial killer on the loose? As Will Trent digs into both crimes it becomes clear that he must solve the cold case in order to find the answer. Yet nearly a decade has passed—time for memories to fade, witnesses to vanish, evidence to disappear, and lies to become truth. But Will can’t crack either mystery without the help of the one person he doesn’t want involved: his girlfriend and Jeffrey Tolliver’s widow, medical examiner Sara Linton. When the past and present begin to collide, Will realizes that everything he values is at stake . . .",Note non disponible,2020-08-04,Fiction
Murder of Innocence,James Patterson,"The world's bestselling thriller writer, James Patterson, is partnering with Discovery ID again to develop all-new true crime stories where murder isn't always the worst thing that can happen to you. MURDER OF INNOCENCE (with Max DiLallo) It's impossible to resist Andrew Luster. He's rich, charming, good-looking, and dozens of women have fallen under his spell. But there's a very dark, very dangerous side to his womanising. And it'll take a global manhunt to put him behind bars. A MURDEROUS AFFAIR (with Andrew Bourelle) Mark Putnam is a rookie FBI agent given his first assignment in a remote part of Kentucky. When female informant Susan Smith helps him make a big break in an important case, rumours begin circulating about an affair and a pregnancy. Then Susan suddenly disappears . . .",Note non disponible,2020-11-12,True Crime
Jingle All the Way,Debbie Macomber,"NEW YORK TIMES BESTSELLER • Love can transform even the best-laid plans in this heartfelt Christmas novel from the queen of Christmas stories, Debbie Macomber. Trapped in the middle of five siblings, Everly Lancaster always had big dreams. Now a top real-estate executive, Everly finds her work is her life, leaving no space for anything (or anyone) else. Sensing her stress, Everly’s boss insists she take December off. At first, a month away seems crazy—how will the company survive without her? But Everly’s mother convinces her otherwise. She deserves a vacation—plus, when she returns, she’ll have no excuse to skip family Christmas like she did last year. But after her vengeful assistant books a guided cruise in the Amazon instead of the luxury beach vacation she expected, Everly is horrified to realize that she’s about to spend the next two weeks trapped—with no Wi-Fi!—in the rain forest. Not even Asher Adams, the ship’s charming naturalist, can convince Everly that the trip will be unforgettable. Slowly but surely, she realizes he is right: the sights are spectacular. And with each passing day, Everly’s relationship with Asher deepens, forcing her to take a long, hard look at her priorities. Everly and Asher begin to see magic in the possibility of a life together. But as the cruise nears its end, and Everly’s family Christmas approaches, both must decide if love is worth the risk. A merry surprise may be in store in Debbie Macomber’s newest holiday delight.",Note non disponible,2020-10-13,Fiction
Christmas at Holiday House,RaeAnne Thayne,"In the town of Silver Bells, there’s always a feeling of Christmas in the air… Let love—and RaeAnne Thayne—melt your heart this holiday season! This New Year will bring widowed nurse Abigail Powell a fresh start in a different city. Excited about the chance to create an unforgettable Christmas for her young son in picturesque Silver Bells, Colorado, Abby has been hired to take care of her dear friend’s recuperating grandmother. But sprightly senior Winnie insists she doesn’t need looking after. What she does need is help decorating her historic mansion, Holiday House, for a seasonal town fundraiser. Abby warms to the festive task, but she’ll have to contend with her own personal Grinch: Winnie’s prickly grandson, Ethan Lancaster. Ethan Lancaster is good at a lot of things. Relationships surely aren’t one of them. His ex-fiancée convinced Ethan he was incapable of love, and he believes her…up until the moment he impulsively kisses Abby. What is it about this vibrant woman and her sweet son that knocks his world off-kilter? He knows they’re leaving town after Christmas. He just didn’t expect they’d be taking a little of his heart with them. But as he and Abby work together on the magical Holiday House through the record cold weather, visions of a different future dance in his head…one filled with warmth, love and a new beginning for them both. Return to Hope’s Crossing this Christmas in New York Times bestselling author RaeAnne Thayne’s latest heartwarming story of matchmaking at the holidays, All is Bright!",Note non disponible,2020-10-13,Fiction
Never After: The Thirteenth Fairy,Melissa de la Cruz,"*A B&N Young Reader Monthly Pick!* *Finalist in the 2021 Goodreads Choice Awards!* *A New York Times Bestseller!* Discover a new middle-grade fantasy saga from the #1 New York Times bestselling author of The Descendants series, Melissa de la Cruz, where real life and fairy tales collide! Nothing ever happens in Filomena Jefferson-Cho’s sleepy little suburban town of North Pasadena. The sun shines every day, the grass is always a perfect green, and while her progressive school swears there’s no such thing as bullying, she still feels bummed out. But one day, when Filomena is walking home on her own, something strange happens. Filomena is being followed by Jack Stalker, one of the heroes in the Thirteenth Fairy, a series of books she loves about a brave girl and her ragtag group of friends who save their world from an evil enchantress. She must be dreaming, or still reading a book. But Jack is insistent—he’s real, the stories are real, and Filomena must come with him at once! Soon, Filomena is thrust into the world of evil fairies and beautiful princesses, sorcerers and slayers, where an evil queen drives her ruthless armies to destroy what is left of the Fairy tribes. To save herself and the kingdom of Westphalia, Filomena must find the truth behind the fairytales and set the world back to rights before the cycle of sleep and destruction begins once more.",Note non disponible,2020-12-01,Juvenile Fiction
Pax et le petit soldat,Sara Pennypacker,"Un superbe roman d'aventures, l'histoire poignante d'une amitié entre un enfant et un animal. Consacré Meilleur roman jeunesse 2016 par le Publishers Weekly. Prix Sorcières 2018 catégorie Carrément Passionnant Mini. Prix Enfantaisie 2018. Prix des Libraires du Québec 2018. Acclamé par les auteurs de littérature jeunesse: • 'Un chef-d'œuvre, tout simplement!' Katherine Applegate • 'Le livre est comme le renard: à moitié sauvage et absolument superbe.' Katherine Rundell • 'Merveilleuse conteuse, S. Pennypacker entraîne le lecteur sur une route pleine de désen-chantements et d'espoirs jusqu'à une fin déchirante.' Ann M. Martin",Note non disponible,2020-01-03T00:00:00+01:00,Juvenile Fiction
Kingdom of the Wicked,Kerri Maniscalco,"A James Patterson Presents Novel From the #1 New York Times and USA Today bestselling author of the Stalking Jack the Ripper series comes a new blockbuster series... Two sisters.One brutal murder. A quest for vengeance that will unleash Hell itself... And an intoxicating romance. Emilia and her twin sister Vittoria are streghe -- witches who live secretly among humans, avoiding notice and persecution. One night, Vittoria misses dinner service at the family's renowned Sicilian restaurant. Emilia soon finds the body of her beloved twin...desecrated beyond belief. Devastated, Emilia sets out to find her sister's killer and to seek vengeance at any cost-even if it means using dark magic that's been long forbidden. Then Emilia meets Wrath, one of the Wicked-princes of Hell she has been warned against in tales since she was a child. Wrath claims to be on Emilia's side, tasked by his master with solving the series of women's murders on the island. But when it comes to the Wicked, nothing is as it seems...",5,2020-10-27,Young Adult Fiction
